"Canada is the country that contains more than half of all the natural lakes in the world.","Canada"
"Australia is the flattest continent.","Australia"
"Saudi Arabia is the largest country on the Arabian Peninsula.","Saudi Arabia"
"The country Chile accounts for more than half of the western coastline of South America.","Chile"
"Sudan is the African nation with the most pyramids.","Sudan"
"Africa is the only continent with land in all four hemispheres.","Africa"
"Brazil is the most populated nation in South America.","Brazil"
"Russia is the largest country in the world in terms of land area.","Russia"